{
  "challenge": "Você vai pegar UM lanche da escola pra próxima semana — 5 dias. Tem 5 opções no cardápio da cantina. Escolhe 2 a 3 que vão se alternar. Cada uma ganha em uma frente e perde noutra.",
  "constraints": [
    {
      "id": "f",
      "label": "Sanduíche de frango com salada (R$ 14)",
      "cost": "22g de proteína; baixo açúcar; gosto neutro — a maioria acha 'sem sal'"
    },
    {
      "id": "p",
      "label": "Pão de queijo recheado com presunto e queijo (R$ 10)",
      "cost": "9g de proteína; gostoso; gordura saturada alta; bate a vontade na hora"
    },
    {
      "id": "c",
      "label": "Cookie grande de chocolate (R$ 6)",
      "cost": "Quase nada de proteína (2g); açúcar alto; é o lanche mais vendido por sabor"
    },
    {
      "id": "i",
      "label": "Iogurte natural com granola (R$ 12)",
      "cost": "11g de proteína; pouco açúcar; precisa colher; embalagem pesa na mochila"
    },
    {
      "id": "m",
      "label": "Mix de castanhas em pacote (R$ 15)",
      "cost": "8g de proteína; saciedade alta por ser gordura boa; gosto OK; cara por porção"
    }
  ],
  "must_pick": 3,
  "outcomes": {
    "f+i+m": "Combo PROTEÍNA + GORDURA BOA: sanduíche + iogurte + castanhas. Total semana 3x = bem nutrido. Tradeoff aceito: paga mais caro (R$ 41 por dia em média) e perde no quesito 'sabor que dá vontade'. Bom pra quem treina ou estuda muito.",
    "f+p+c": "Combo BARATO COM PRAZER: sanduíche bom + pão de queijo gostoso + cookie de premiar. Cobre proteína no dia do sanduíche; nos outros, paga em açúcar e gordura. Tradeoff: variedade alta, nutrição média. Vence em adesão — você come até o fim da semana.",
    "p+c+i": "Combo SOCIAL: tudo que os amigos compram (pão de queijo + cookie) + iogurte como contrapeso. Tradeoff: ganha em pertencimento, perde em proteína média (só 22g em 3 dias). Em 1 mês, energia cai à tarde.",
    "f+i+c": "Combo HONESTO: 2 lanches sérios + cookie pra não passar a semana inteira sem doce. Tradeoff equilibrado: proteína (33g em 2 dias), açúcar contido (1 dia), aderência alta. Pacote mais sustentável do menu.",
    "p+m+c": "Combo APARÊNCIA DE BOM: pão de queijo (parece nutritivo), castanha (parece saudável), cookie (recompensa). Tradeoff falso: castanha é cara por porção pequena e o pão de queijo é gordura saturada. Você gasta R$ 31 médio e fica sem proteína estrutural."
  }
}
