{
  "challenge": "Você precisa ensinar UMA coisa que sabe (frações, escala musical, tutorial de jogo, regra de jogo de carta) pro irmão mais novo. Tem 20 min. Escolhe 2 a 4 técnicas — cada uma força um tipo de aprendizado e ignora outro.",
  "constraints": [
    {
      "id": "f",
      "label": "FALAR a teoria primeiro, depois mostrar exemplo — método clássico de escola",
      "cost": "Fácil pra quem ensina; o ouvinte esquece 80% em 24h se não pratica; vira monólogo"
    },
    {
      "id": "p",
      "label": "PEDIR pra ele tentar fazer ANTES de você explicar — ele erra primeiro",
      "cost": "Frustra muito no início; precisa de aceitação dele em ficar sem saber 5 min; corre risco de desistência"
    },
    {
      "id": "e",
      "label": "PEDIR pra ele EXPLICAR de volta pra você no fim — versão dele, com palavras dele",
      "cost": "Ele tem que ter prestado atenção; expõe lacunas (bom e desconfortável); leva 5-8 min a mais"
    },
    {
      "id": "h",
      "label": "Inserir UMA história ou exemplo do dia a dia dele — tipo 'lembra quando jogamos X?'",
      "cost": "Você precisa saber o que ele faz; analogia pode confundir se mal escolhida; gasta 2-3 min de set-up"
    },
    {
      "id": "q",
      "label": "Fazer 3 PERGUNTAS no meio da aula — sem ele responder, você não continua",
      "cost": "Quebra ritmo do ensino; ele pode travar e ficar tímido; exige paciência sua"
    },
    {
      "id": "d",
      "label": "DESENHAR no papel ou no celular — visualizar enquanto fala",
      "cost": "Toma tempo de produção; pode virar muleta visual e ele não internalizar; depende do desenho ser claro"
    }
  ],
  "must_pick": 3,
  "outcomes": {
    "p+e+h": "Combo aprendizado ATIVO pesado: ele tenta antes (p) + explica no fim (e) + ancora numa história dele (h). Tradeoff: leva 18-20 min reais e exige paciência alta. Retenção 7 dias depois: 70%. Quase escola individual.",
    "f+d+q": "Combo PROFESSOR TRADICIONAL melhorado: explica (f) + desenha (d) + pergunta no meio (q). Tradeoff: confortável pra quem ensina, médio em retenção (40% em 7 dias). Bom pra conteúdo VISUAL onde desenho ajuda muito.",
    "p+e+q": "Combo SOCRÁTICO puro: ele tenta + você pergunta + ele explica. Tradeoff: 80% do tempo é dele falando. Você descobre o que ele NÃO sabia, e ele descobre que sabe mais do que pensava. Exige maturidade do irmão; em criança menor de 8, frustra.",
    "f+h+d": "Combo NARRATIVO: fala + história do dia a dia + desenho. Tradeoff: ótimo pra MEMÓRIA ('lembra do desenho daquele dia?'), médio pra HABILIDADE (ele não treinou nada). Bom pra ensinar conceito; ruim pra ensinar técnica.",
    "p+e+h+q": "Pacote completo: 4 técnicas ativas. Tradeoff: tempo apertado em 20 min — alguma coisa fica meia-boca. Mas retenção 7 dias é a maior (75-80%). Se você só pode investir 20 min UMA vez na semana, este é o combo que rende mais por minuto."
  }
}
