{
  "challenge": "Você ganhou R$ 50 de mesada inesperada. Tem 8 desejos na lista — todos somam R$ 130. Escolhe 2 a 4 itens dentro do orçamento. Antes de pagar qualquer um, separa quanto vai pra POUPANÇA primeiro.",
  "constraints": [
    {
      "id": "s",
      "label": "POUPAR R$ 15 do total numa caixinha ou conta — paga você mesmo do futuro antes de qualquer compra",
      "cost": "Sobram R$ 35 pros desejos; sensação imediata de 'menos dinheiro'"
    },
    {
      "id": "l",
      "label": "Lanche caro que você vinha desejando há semanas (R$ 28)",
      "cost": "Some em 15 min de mastigação; satisfaz a vontade acumulada"
    },
    {
      "id": "f",
      "label": "Fone de ouvido bom-e-barato pra ouvir música sem incomodar (R$ 35)",
      "cost": "Dura 6 meses se cuidar; ocupa quase todo o orçamento se não poupar antes"
    },
    {
      "id": "k",
      "label": "Skin nova de jogo (R$ 25)",
      "cost": "Dura enquanto a conta do jogo durar; status entre amigos do jogo"
    },
    {
      "id": "c",
      "label": "Caderno bonito que vai te dar vontade de estudar (R$ 18)",
      "cost": "Útil 1 ano; depende de você usar de verdade; em geral usa 2 semanas"
    },
    {
      "id": "p",
      "label": "Presente pra alguém da família (R$ 20)",
      "cost": "Some no momento de entregar; constrói relação; difícil voltar atrás"
    }
  ],
  "must_pick": 3,
  "outcomes": {
    "s+l+c": "Você pagou pra você mesmo primeiro (s, R$ 15), depois o lanche (R$ 28) e o caderno (R$ 18). Soma R$ 61 — passou em R$ 11. Você precisa cortar o caderno OU baixar o lanche pra versão menor. Aprendeu na pele que orçamento manda no desejo, não o contrário.",
    "s+f+k": "Poupou R$ 15 + fone (R$ 35) + skin (R$ 25). Soma R$ 75 — não fecha. Quem paga-se primeiro vê isso ANTES de comprar e corta a skin. Quem não paga-se primeiro vê DEPOIS, parcelando o que devia ser à vista, e dá início ao endividamento.",
    "l+f+k+c": "Sem poupar nada: lanche + fone + skin + caderno = R$ 106. Passou em R$ 56. Resultado tradicional: corta o caderno e a skin, gasta os R$ 50 em lanche e fone, dorme com a sensação de que o dinheiro 'não rendeu nada'. Em 1 mês está sem fone funcionando e sem 1 centavo guardado.",
    "s+p+c": "Combo quieto: poupar (R$ 15) + presente (R$ 20) + caderno (R$ 18) = R$ 53, passa em R$ 3. Corta o caderno pra versão simples. Não comprou nada de consumo imediato. Em 6 meses ninguém lembra da mesada — mas a poupança continua lá.",
    "s+l+k": "Pagou-se primeiro + lanche + skin = R$ 68. Passou em R$ 18. Tradução: ou você cancela a skin, ou come um lanche mais barato. O hábito de poupar R$ 15 ANTES não impede consumo — impede sumiço total da mesada. Em 1 ano com 12 mesadas assim, R$ 180 acumulados sem dor."
  }
}
