{
  "challenge": "Projeta um avião de papel com UMA folha A4, sem cola, sem fita. Vai voar a maior distância possível em sala — entre 4 e 8 metros até bater na parede. Cada escolha de design vence num critério e perde noutro.",
  "constraints": [
    {
      "id": "a",
      "label": "Asa LARGA e curta — gera muita sustentação por área",
      "cost": "Voa devagar; vento lateral em janela aberta derruba; sensível à respiração da turma"
    },
    {
      "id": "f",
      "label": "Asa FINA e longa, ponta dobrada pra cima — estabilidade tipo planador",
      "cost": "Pesa mais na ponta da asa; precisa de lançamento cuidadoso; trinca no centro com 2 lançamentos"
    },
    {
      "id": "n",
      "label": "Nariz PESADO com várias dobras no bico — corta vento, mantém direção",
      "cost": "Cai rápido se asa for pequena; aterrissagem sempre de bico, amassa o nariz a cada vez"
    },
    {
      "id": "s",
      "label": "Cauda em V cortada na parte traseira — funciona como leme",
      "cost": "Aerodinamicamente útil, mas exige cortes precisos; sem tesoura, fica torto e desvia"
    },
    {
      "id": "d",
      "label": "Dobras EXTRAS de reforço na linha central — rigidez no meio da fuselagem",
      "cost": "Cada dobra extra encurta a asa final; aumenta peso sem trazer sustentação"
    },
    {
      "id": "l",
      "label": "Lançamento com força moderada e ângulo de 15° pra cima",
      "cost": "Não é design — é técnica; precisa treinar 3 lançamentos antes do oficial"
    }
  ],
  "must_pick": 3,
  "outcomes": {
    "a+n+l": "Combo clássico de competição infantil: asa larga + nariz pesado + lançamento moderado. Voa baixinho, devagar, longe. Funciona em sala sem vento. Risco: se alguém abre a janela, vira tudo. Tradeoff aceito: distância em troca de robustez a ambiente.",
    "f+s+l": "Combo planador: asa fina longa + cauda em V + lançamento técnico. Vai LONGE quando lançado bem (recorde fácil de 8m), mas falha rápido em mão amadora. Tradeoff: ganha alcance, perde em facilidade de repetição.",
    "a+d+l": "Asa larga + reforço central + bom lançamento. A dobra central torna o avião mais rígido — voa reto. Mas o reforço come 1 cm de asa final. Estável e curto. Tradeoff: ganha estabilidade, perde alcance puro.",
    "n+s+d": "Combo errado: muito peso pra pouca asa. Nariz pesado + cauda + reforço deixaram a asa MAGRA demais. Cai rápido, voa 2-3m. Tradeoff perdido em todas as pontas — exemplo de design que otimiza partes ignorando o conjunto.",
    "f+n+l": "Asa fina + nariz pesado + lançamento técnico. Equilíbrio entre estabilidade e alcance. Voa mais ALTO antes de planar — ótimo em pé direito alto, ruim em sala baixa. Tradeoff: ganha altitude, perde se o teto for próximo."
  }
}
