{
  "challenge": "Desenha o sistema de notificação ideal pro seu celular: o que entra com beep, o que entra silencioso, o que NÃO entra. Escolha 2 a 4 regras — cada uma corta um tipo de interrupção e cobra um preço diferente.",
  "constraints": [
    {
      "id": "u",
      "label": "Só pessoas (mãe, pai, irmão, 5 amigos) — apps todos no modo silencioso",
      "cost": "Você só vê novidade de apps quando ABRIR o app — pode perder oferta, evento, atualização rápida"
    },
    {
      "id": "h",
      "label": "Notificações só em janela: 12h e 18h. O resto do dia, modo foco automático",
      "cost": "Pode demorar até 6 horas pra ver mensagem importante de quem mandou às 12h05"
    },
    {
      "id": "b",
      "label": "Sem badges vermelhos — você decide quando olhar, não o app",
      "cost": "Esquece de responder coisa pendente porque não tem o lembrete visual"
    },
    {
      "id": "s",
      "label": "Modo silencioso 100% — só vibração, sem som",
      "cost": "Vibração ainda interrompe; e em locais barulhentos pode passar batido"
    },
    {
      "id": "g",
      "label": "Grupo de WhatsApp todos no silencioso, com exceção marcada",
      "cost": "Dá trabalho marcar exceção em cada grupo; precisa revisar quando entra em grupo novo"
    },
    {
      "id": "f",
      "label": "Modo foco automático: liga sozinho de 19h-22h e durante o horário escolar",
      "cost": "Configurar custa 10 minutos; precisa lembrar de revisar quando muda a rotina"
    }
  ],
  "must_pick": 3,
  "outcomes": {
    "u+h+b": "Sistema enxuto: corta beep aleatório (u), agrupa atenção em duas janelas (h), tira pressão visual (b). Bom pra estudante de ensino médio que faz lição em casa. Risco: pais reclamando porque você 'não respondeu rápido' — combine antes.",
    "u+b+f": "Aposta tudo no horário automático. Funciona melhor pra quem tem rotina previsível (escola das 7 às 13). Pessoas no 'modo foco' chegam — apps não. Risco: emergência cair fora da exceção.",
    "h+s+g": "Sistema 'silencioso por padrão': nada faz som, mas tudo continua chegando. Bom pra quem não consegue cortar apps, mas quer parar de ser puxado. Cuidado: o badge ainda vai te chamar quando você desbloquear.",
    "u+h+s+g": "Pacote pesado, 4 regras combinadas. Detox de 2 semanas pra REPAGAR o cérebro a esperar conteúdo, em vez de ele vir até você. Depois você pode soltar uma regra de cada vez e ver qual aguenta."
  }
}
