{
  "challenge": "Desenha o seu bloco de 25 minutos de foco profundo: como o lugar fica, o que faz começar, o que faz terminar. Escolhe 2 a 4 ingredientes — cada um isola o cérebro de um tipo de gatilho diferente.",
  "constraints": [
    {
      "id": "l",
      "label": "Lugar fixo: sempre mesma mesa, mesma cadeira, mesma luz — sinal pro cérebro 'agora é foco'",
      "cost": "Inflexível: se o lugar tá ocupado, você precisa adaptar"
    },
    {
      "id": "c",
      "label": "Celular em outra sala, não silencioso, FORA da vista",
      "cost": "Não pode ser despertador nem agenda no bloco; precisa de relógio separado"
    },
    {
      "id": "r",
      "label": "Ritual de início: 60 segundos respirando + frase escrita 'vou fazer X agora'",
      "cost": "Parece bobo nos primeiros dias; precisa de constância pra virar gatilho"
    },
    {
      "id": "t",
      "label": "Timer visível na mesa — 25 minutos, cronômetro físico (não app)",
      "cost": "Custa R$15 comprar um; gente perto pode achar 'frescura'"
    },
    {
      "id": "m",
      "label": "Música sempre igual: mesma playlist instrumental do início ao fim",
      "cost": "Tédio sonoro depois de semanas; precisa renovar de tempos em tempos"
    },
    {
      "id": "s",
      "label": "Sinal de fim ritual: 'parei' escrito no caderno + 5 min de pausa real",
      "cost": "Quebra o impulso de emendar bloco em bloco; produtivo no curto, custa volume no longo"
    }
  ],
  "must_pick": 3,
  "outcomes": {
    "l+c+t": "Combo clássico físico: lugar (l) + isolar celular (c) + timer físico (t). Funciona em 90% dos casos. Simples, replicável. O cérebro aprende rápido o padrão 'mesa + sem celular + cronômetro' = entrar em foco.",
    "l+c+r": "Foco no ritual mental: lugar + sem celular + frase escrita. Bom pra quem distrai dentro da cabeça, não pelo celular — escrever a meta antes 'tranca' o cérebro num alvo só.",
    "c+t+m": "Aposta no isolamento sonoro: tira celular, conta o tempo, e usa música pra abafar ambiente caótico. Salvação de quem mora em casa barulhenta.",
    "l+r+s": "Bloco 'cerimonial': lugar fixo + ritual de início + ritual de fim. Pesado em ritual, leve em hardware. Bom pra quem tem TDAH leve — o ritual sinaliza início e fim ao cérebro que não quer parar.",
    "l+c+t+s": "Pacote completo: 4 sinais. Treino de regime — em 3 semanas, simplesmente sentar nessa mesa já dispara o modo foco antes do timer ligar. Caro de manter, alto retorno."
  }
}
